GROUP_CLEAN,TEXT_ORI,,,
传真问题,用户传真不会，待用户确认连线，接反了，更改了与800测试成功。 time stamp :12/30/2014 13:33:22 jeff.xu,,,
传真问题,不会传真 带打印 测试页 短线 回电忙 time stamp :12/30/2014 15:32:36 bill.sun 回电正常 time stamp :12/30/2014 17:10:21 bill.sun,,,
不能打印,不能双面打印 设置打印首选项里不能选择到双面打印。建议重装驱动程序。 time stamp :12/30/2014 09:35:31 wendy.lu 回电用户 自己调试之后使用word 可以双面打印了。 time stamp :12/30/2014 16:09:43 wendy.lu,,,
驱动安装,用户来电表示驱动安装不上，带用户卸载重装还是不行，建议换电脑 time stamp :12/24/2014 17:03:33 eirsen.zha 回电：用户表示自己是网吧里面的，暂时无法更换电脑尝试 time stamp :12/30/2014 09:52:54 eirsen.zha,,,
传真问题,打印错误报告 没用过传真 运行传真测试有效插口失败 纠正连线 设置成手动 测试提示是否从玻璃面板发送 恢复默认值 和800测试收发正常 time stamp :12/30/2014 13:04:37 joy.cheng,,,
打印质量,用户来电打印发送的文档 底面灰色 字体是白色的 打印自检正常 自己的图片打印正常 把图片放入word打印不正常 发邮件 800打印正常 建议用户更换图片查看器尝试 time stamp :12/30/2014 14:34:16 harry.zhu,,,
传真问题,电脑接收传真告知没有，运行传真测试正常，降速，就错，测试只能手动，恢复默认自动正常，电脑发送传真，不行，重组不行，换电脑 time stamp :12/30/2014 11:43:09 bonnie.shi 回电还是不行，现在没有时间安装，以后再说，有问题来电或到就近维修站 time stamp :12/30/2014 16:10:57 bonnie.shi,,,
传真问题,咨询是否可以电脑接收传真，告知不能 time stamp :12/30/2014 15:08:09 elma.sun,,,
驱动安装,驱动安装不上，发送net3.5链接和1108替代驱动尝试 time stamp :12/30/2014 12:37:36 vivian.lu 回电，用户表示应该没什么问题，有问题再来电 time stamp :12/30/2014 13:54:22 vivian.lu,,,
传真问题,无法传真，报告全通过，传真四步，正常传真。 time stamp :12/30/2014 15:03:14 cliff.cao,,,
传真问题,用户来电没有信号音，其他正常，线路连反了，带用户重新连线， time stamp :12/29/2014 10:27:14 angie.zhang 回电无人接听 time stamp :12/29/2014 14:30:58 angie.zhang 回电线连反了，可以传真，问题已解决 time stamp :12/30/2014 16:50:02 angie.zhang,,,
传真问题,不知道怎么传真，告知操作方法，回电 回电：告知发送方法，与800测试ok time stamp :12/30/2014 09:50:36 elma.sun,,,